{
  "id": "testOnReflect",
  "name": "Run Reflect Test",
  "description": "Run tests on Reflect",
  "category": "Continuous Integration",
  "badge": "New",
  "icon-name": "reflect",
  "tags": ["ui-test", "reflect", "reflect"],
  "template-location": "./cloudformation/test-on-reflect.yaml",
  "ui-hints-location": "./ui-hints/test-on-reflect.json"
}
